{
  "schema_version": "kspacejet.plan-build-request/v1",
  "kind": "PlanBuildRequest",
  "resolved_pipeline_digest": "sha256:1111111111111111111111111111111111111111111111111111111111111111",
  "requested_profile": "bounded-online",
  "scan_descriptor_digest": "sha256:2222222222222222222222222222222222222222222222222222222222222222",
  "target_envelope_digest": "sha256:3333333333333333333333333333333333333333333333333333333333333333",
  "machine_policy_digest": "sha256:4444444444444444444444444444444444444444444444444444444444444444",
  "operator_contracts": [
    {
      "node_id": "reconstruct",
      "contract_digest": "sha256:eeeeeeeeeeeeeeeeeeeeeeeeeeeeeeeeeeeeeeeeeeeeeeeeeeeeeeeeeeeeeeee"
    }
  ]
}
